{
  "schema_version": "1.0",
  "evidence_type": "k-slide-ksa38-candidate-evidence",
  "project": "k-slide",
  "issue_id": "CHG-16",
  "operation": "BUILD",
  "request": "chg16-requirement-traceability-01",
  "exact_base": {
    "commit_sha": "23669bacb0392aecc009ae19c7b8c645f1d8c7dd",
    "tree_oid": "e049fcc0e5d245630c1a47e1ec08d30f6419d6c2"
  },
  "work_branch": "codex/k-slide-chg16-requirement-traceability-01",
  "product_subject_sha": "23669bacb0392aecc009ae19c7b8c645f1d8c7dd",
  "change_base_sha": "af5836540304b424289bedbe57a87dbb5d02763f",
  "artifacts": {
    "matrix": {
      "path": "traceability/ksa38/traceability.v1.json",
      "sha256": "52ccb700509310ed0f696774c6c23787aa2f62f30bceaef39ffa4eca3be08b2c",
      "version": "1.0"
    },
    "matrix_schema": {
      "path": "traceability/ksa38/schema.v1.json",
      "sha256": "2b7c2e09d8de7e11ca1a228cd42a34af0243bdda7c018f34d7971b4463cecdfc",
      "version": "1.0"
    },
    "candidate_evidence_schema": {
      "path": "traceability/ksa38/candidate-evidence.schema.v1.json",
      "sha256": "0917a6ddac2d3cdec3ae74f2c31ce526d6c48c3ceda0eb9c6808114d80a17016",
      "version": "1.0"
    },
    "qualification_manifest": {
      "path": "traceability/ksa38/qualification.v1.json",
      "sha256": "bed0640692b46da2b6425441405bb1daea6c0eaac604c46229946b2a5f49f39e",
      "version": "1.0"
    },
    "qualification_schema": {
      "path": "traceability/ksa38/qualification.schema.v1.json",
      "sha256": "6e08fd8b87641efc4ecfff721dd993882bb80c0e4e11b22b2824c6c8b433a610",
      "version": "1.0"
    }
  },
  "project_os_closure_snapshot": {
    "authority": "USER_SUPPLIED_AUTHORITATIVE_SNAPSHOT",
    "items": [
      {
        "ksa_id": "KSA-01",
        "state": "DONE_INTEGRATED"
      },
      {
        "ksa_id": "KSA-02",
        "state": "DONE_INTEGRATED"
      },
      {
        "ksa_id": "KSA-03",
        "state": "DONE_INTEGRATED"
      },
      {
        "ksa_id": "KSA-04",
        "state": "QUEUED"
      },
      {
        "ksa_id": "KSA-05",
        "state": "QUEUED"
      },
      {
        "ksa_id": "KSA-06",
        "state": "DONE_INTEGRATED"
      },
      {
        "ksa_id": "KSA-07",
        "state": "ACTIVE_VERIFY_REQUIRED"
      },
      {
        "ksa_id": "KSA-08",
        "state": "QUEUED"
      },
      {
        "ksa_id": "KSA-09",
        "state": "QUEUED"
      },
      {
        "ksa_id": "KSA-10",
        "state": "QUEUED"
      },
      {
        "ksa_id": "KSA-11",
        "state": "QUEUED"
      },
      {
        "ksa_id": "KSA-12",
        "state": "QUEUED"
      },
      {
        "ksa_id": "KSA-13",
        "state": "DONE_INTEGRATED"
      },
      {
        "ksa_id": "KSA-14",
        "state": "DONE_INTEGRATED"
      },
      {
        "ksa_id": "KSA-15",
        "state": "DONE_INTEGRATED"
      },
      {
        "ksa_id": "KSA-16",
        "state": "DONE_INTEGRATED"
      },
      {
        "ksa_id": "KSA-17",
        "state": "DONE_INTEGRATED"
      },
      {
        "ksa_id": "KSA-18",
        "state": "DONE_INTEGRATED"
      },
      {
        "ksa_id": "KSA-19",
        "state": "DONE_INTEGRATED"
      },
      {
        "ksa_id": "KSA-20",
        "state": "ACTIVE"
      },
      {
        "ksa_id": "KSA-21",
        "state": "QUEUED"
      },
      {
        "ksa_id": "KSA-22",
        "state": "QUEUED"
      },
      {
        "ksa_id": "KSA-23",
        "state": "QUEUED"
      },
      {
        "ksa_id": "KSA-24",
        "state": "QUEUED"
      },
      {
        "ksa_id": "KSA-25",
        "state": "QUEUED"
      },
      {
        "ksa_id": "KSA-26",
        "state": "QUEUED"
      },
      {
        "ksa_id": "KSA-27",
        "state": "QUEUED"
      },
      {
        "ksa_id": "KSA-28",
        "state": "QUEUED"
      },
      {
        "ksa_id": "KSA-29",
        "state": "QUEUED"
      },
      {
        "ksa_id": "KSA-30",
        "state": "QUEUED"
      },
      {
        "ksa_id": "KSA-31",
        "state": "QUEUED"
      },
      {
        "ksa_id": "KSA-32",
        "state": "DONE_INTEGRATED"
      },
      {
        "ksa_id": "KSA-33",
        "state": "DONE_INTEGRATED"
      },
      {
        "ksa_id": "KSA-34",
        "state": "DONE_INTEGRATED"
      },
      {
        "ksa_id": "KSA-35",
        "state": "DONE_INTEGRATED"
      },
      {
        "ksa_id": "KSA-36",
        "state": "DONE_INTEGRATED"
      },
      {
        "ksa_id": "KSA-37",
        "state": "DONE_INTEGRATED"
      }
    ]
  },
  "coverage": {
    "trace_rows": 35,
    "canonical_clauses": 35,
    "contract_families": 8,
    "ksa_items": 37,
    "ownership_counts": {
      "REPOSITORY_OWNED": 14,
      "MIXED_REPOSITORY_AND_EXTERNAL": 20,
      "EXTERNAL_PRODUCTION_GATE": 1
    },
    "implementation_state_counts": {
      "IMPLEMENTED": 14,
      "PARTIAL": 20,
      "REUSED_UNCHANGED": 0,
      "NOT_IMPLEMENTED": 0,
      "EXTERNAL_ONLY": 1
    },
    "closure_state_counts": {
      "DONE_INTEGRATED": 17,
      "ACTIVE_VERIFY_REQUIRED": 1,
      "ACTIVE": 1,
      "QUEUED": 18
    },
    "gap_classification_counts": {
      "OPEN_EXTERNAL_PRODUCTION_GATE": 21,
      "OPEN_PROJECT_OS_RECONCILIATION": 18,
      "OPEN_REPOSITORY_REQUIREMENT": 0,
      "ORPHAN_REQUIREMENT": 0
    },
    "changed_path_coverage": {
      "commit_count": 152,
      "changed_paths": 229,
      "requirement_referenced_paths": 137,
      "closed_classification_paths": 92,
      "historical_paths": 3,
      "unexplained_paths": 0
    }
  },
  "qualification_checks": [
    {
      "name": "focused_ksa38_traceability_tests",
      "command": "rtk python3.11 -m pytest -q tests/test_ksa38_traceability.py",
      "python_version": "3.11.7",
      "status": "PASS",
      "tests_passed": 16,
      "tests_skipped": 0,
      "warnings": 0,
      "details": "Focused schema, exact subject/span, clause/KSA/path coverage, closure separation, locator, gap, and report tests."
    },
    {
      "name": "focused_ksa38_traceability_tests",
      "command": "rtk /tmp/k-slide-ksa37-py312/bin/python -m pytest -q tests/test_ksa38_traceability.py",
      "python_version": "3.12.9",
      "status": "PASS",
      "tests_passed": 16,
      "tests_skipped": 0,
      "warnings": 0,
      "details": "Focused schema, exact subject/span, clause/KSA/path coverage, closure separation, locator, gap, and report tests."
    },
    {
      "name": "full_repository_python_suite",
      "command": "rtk proxy env PYTHONPATH=src:. python3.11 -m pytest -q",
      "python_version": "3.11.7",
      "status": "PASS",
      "tests_passed": 750,
      "tests_skipped": 5,
      "warnings": 1,
      "details": "The single warning is the installed fontTools py23 deprecation warning. Full discovery includes certification, release, security, runtime, and Python host regressions."
    },
    {
      "name": "full_repository_python_suite",
      "command": "rtk proxy env PYTHONPATH=src:. /tmp/k-slide-ksa37-py312/bin/python -m pytest -q",
      "python_version": "3.12.9",
      "status": "PASS",
      "tests_passed": 744,
      "tests_skipped": 11,
      "warnings": 0,
      "details": "Full discovery includes certification, release, security, runtime, and Python host regressions."
    },
    {
      "name": "exact_subject_change_span_matrix_validation",
      "command": "tools/ksa38/validate_traceability.py --check-report",
      "python_version": "3.11.7",
      "status": "PASS",
      "tests_passed": null,
      "tests_skipped": null,
      "warnings": 0,
      "details": "Independently rederived the 152-commit ancestor span and all 229 paths; 35 clauses, 37 KSAs, and zero unexplained paths."
    },
    {
      "name": "exact_subject_change_span_matrix_validation",
      "command": "tools/ksa38/validate_traceability.py --check-report",
      "python_version": "3.12.9",
      "status": "PASS",
      "tests_passed": null,
      "tests_skipped": null,
      "warnings": 0,
      "details": "Independently rederived the 152-commit ancestor span and all 229 paths; 35 clauses, 37 KSAs, and zero unexplained paths."
    },
    {
      "name": "repository_json_schemas_draft_2020_12",
      "command": "Draft202012Validator.check_schema over every repository schema JSON file",
      "python_version": "3.11.7",
      "status": "PASS",
      "tests_passed": 13,
      "tests_skipped": 0,
      "warnings": 0,
      "details": "All 10 existing schemas and the 3 dedicated KSA-38 schemas passed Draft 2020-12 meta-schema validation."
    },
    {
      "name": "repository_json_schemas_draft_2020_12",
      "command": "Draft202012Validator.check_schema over every repository schema JSON file",
      "python_version": "3.12.9",
      "status": "PASS",
      "tests_passed": 13,
      "tests_skipped": 0,
      "warnings": 0,
      "details": "All 10 existing schemas and the 3 dedicated KSA-38 schemas passed Draft 2020-12 meta-schema validation."
    },
    {
      "name": "runtime_errorcode_parity",
      "command": "pytest -q tests/test_chg16_resource_budget.py -k resource_budget_and_telemetry_error_schemas_match_runtime_contract",
      "python_version": "3.11.7",
      "status": "PASS",
      "tests_passed": 1,
      "tests_skipped": 0,
      "warnings": 0,
      "details": "Runtime ErrorCode and schema parity regression passed."
    },
    {
      "name": "runtime_errorcode_parity",
      "command": "pytest -q tests/test_chg16_resource_budget.py -k resource_budget_and_telemetry_error_schemas_match_runtime_contract",
      "python_version": "3.12.9",
      "status": "PASS",
      "tests_passed": 1,
      "tests_skipped": 0,
      "warnings": 0,
      "details": "Runtime ErrorCode and schema parity regression passed."
    },
    {
      "name": "workflow_yaml_and_embedded_shell",
      "command": "PyYAML safe_load for .github/workflows/*.yml and bash -n for each embedded run step",
      "python_version": "3.11.7",
      "status": "PASS",
      "tests_passed": null,
      "tests_skipped": 0,
      "warnings": 0,